{
  "id": "2026-10-05T09-47-13-134Z-run-next-generic-SMOKE-AUTOMATION-001",
  "task_type": "implement_slice",
  "slice_ref": {
    "slice_id": "SMOKE-AUTOMATION-001",
    "slice_number": 1,
    "slice_title": "Automation smoke slice",
    "dependency_tree_path": ".docs/slice_dependency_tree.json",
    "slice_detail_dir": ".docs/slices"
  },
  "orchestrator_ref": {
    "run_id": "2026-10-05T09-47-13-134Z-run-next-generic-SMOKE-AUTOMATION-001",
    "orchestrator_type": "slice_pipeline",
    "dispatched_at": "2026-10-05T09:47:13.135Z"
  },
  "adapter_type": "generic",
  "payload": {
    "instructions": "You are running the repo-local slice pipeline inside an agentic coding harness.\nHarness: Any harness (bring your own command) (generic).\nHard constraints:\n- Read and follow AGENTS.md and repo-local policy before any git operation.\n- Use only the approved slice-pipeline subagents: slice-preflight, slice-implementer, pr-babysitter.\n- Keep one slice, one PR, no fan-out.\n- Do not implement a different slice.\n- Do not commit secrets, tokens, browser sessions, local MCP config, or runtime handoff artifacts.\n- Runtime handoff files belong under .drake/runs/ and must not be committed.\nRead first:\n- AGENTS.md\n- .docs/git_workflow.md\n- .docs/agent_automation_execution_policy.md\n- .docs/agent_automations.md\n- .docs/agent_prompts/slice-pipeline-automation.md\n- .docs/agent_prompts/slice-pipeline-handoff-contract.md\nConfigured project values:\n```json\n{\n  \"projectName\": \"Smoke App\",\n  \"projectId\": \"smoke-app\",\n  \"githubSlug\": \"smoke-org/smoke-app\",\n  \"localPath\": \"/tmp/drake-fixture-WDLW\",\n  \"integrationBranch\": \"dev\",\n  \"featureBranchPrefix\": \"agent/\",\n  \"legacyFeatureBranchPrefixes\": [\n    \"cursor/\"\n  ],\n  \"selectorCommand\": \"python3 scripts/select_next_automation_slice.py --tree .docs/slice_dependency_tree.json\",\n  \"validationCommands\": [\n    \"bash scripts/ci_preflight.sh\"\n  ],\n  \"docsSyncCommand\": \"not configured\",\n  \"harness\": \"generic\",\n  \"model\": null\n}\n```\nNormalized payload:\n```json\n{\n  \"target_repo_id\": \"smoke-app\",\n  \"target_github_slug\": \"smoke-org/smoke-app\",\n  \"target_local_path\": \"/tmp/drake-fixture-WDLW\",\n  \"integration_branch\": \"dev\",\n  \"target_slice_id\": \"SMOKE-AUTOMATION-001\",\n  \"target_slice_number\": 1,\n  \"target_slice_title\": \"Automation smoke slice\",\n  \"dependency_tree_path\": \".docs/slice_dependency_tree.json\",\n  \"slice_backlog_path\": \".docs/slice_backlog.md\",\n  \"slice_detail_dir\": \".docs/slices\",\n  \"fanout_limit\": 1,\n  \"trigger_reason\": \"generic harness via slice-agent-runner\"\n}\n```\nRequired final handoff:\n- routing path: A, B, or STOP\n- selected slice\n- PR URL/state if any\n- merge action if any\n- validation summary\n- docs sync result if any\n- webhook chaining result if any\n- blockers",
    "working_directory": "/tmp/drake-fixture-WDLW",
    "branch_prefix": "agent/",
    "target_branch": "dev"
  },
  "context": {
    "repo_url": "https://github.com/smoke-org/smoke-app",
    "github_slug": "smoke-org/smoke-app",
    "integration_branch": "dev",
    "environment": "local",
    "tags": {
      "harness": "generic",
      "prompt_file": "/tmp/drake-fixture-WDLW/.drake/runs/2026-10-05T09-47-13-134Z-run-next-generic-SMOKE-AUTOMATION-001/prompt.txt"
    }
  },
  "created_at": "2026-10-05T09:47:13.135Z"
}
